ID,Name,Description,ShortName,FileType,CSSClass,ArticleID
1,Beware of Scam!,a perfectly normal chicken,article1,jpeg,standard,1
2,Community Notice: We sell LIVING BREATHING CHICKEN!,"JUST BECAUSE IT TASTE LIKE ONE, DOESN'T MEAN THAT THIS IS THE PLATFORM TO SELL IT!!!",article2,jpeg,standard,2
3,Are your eggs organic?,eggs in shelves,article3,jpeg,standard,3
4,BIG SALE,BIG SALE!!,article4,png,standard,4
5,Chicken Market X Pokemon is Here!!,Pokemon and Chicken Market are having a collab! Every purchase get a Pokemon card!,article5,png,standard,5
